##_ver=20121031_014752
##_ver=20121212_225051
##_ver=20130407_224842




== 20140329_171122 ==

* mysql>
 <pre>
mysql> ? log10
Name: 'LOG10'
Description:
Syntax:
LOG10(X)

Returns the base-10 logarithm of X.

URL: http://dev.mysql.com/doc/refman/5.6/en/mathematical-functions.html

Examples:
mysql> SELECT LOG10(2);
        -> 0.30102999566398
mysql> SELECT LOG10(100);
        -> 2
mysql> SELECT LOG10(-100);
        -> NULL

mysql> select log(10,1/10);
+---------------------+
| log(10,1/10)        |
+---------------------+
| -0.9999999999999998 |
+---------------------+
1 row in set (0.00 sec)
</pre>




* mysql>
 <pre>
select file_name as fname, count_read as rcount, count_write as wcount, sum_number_of_bytes_read as rbytes, sum_number_of_bytes_write as wbytes, avg_timer_read as rtime_avg, avg_timer_write as wtime_avg, sum_timer_read as rtime_sum, sum_timer_write as wtime_sum, sum_number_of_bytes_read/count_read as riosz, sum_number_of_bytes_write/count_write as wiosz, log(10, count_read/count_write) as rwc_ratio_log10, log(10, sum_number_of_bytes_read/sum_number_of_bytes_write) as rwb_ratio_log10 from performance_schema.file_summary_by_instance order by wbytes desc limit 10;
</pre>






== 20140327_092139 ==

* Create a table, and load file data to the table

 <pre>
blusjune$
cat > /tmp/log << EOF
name owner species sex birth death
Puffball Diane hamster f 1999-03-30 NULL
Slim Benny snake m 1996-04-29 NULL
Chirpy Gwen bird f 1998-09-11 NULL
Fang Benny dog m 0000-00-00 NULL
"My Rose" "George Michael" cat m 1987-03-14 NULL
EOF
</pre>

 <pre>
blusjune$
mysql -p -u root -e "
DROP TABLE test.pet8;
CREATE TABLE test.pet8 (name VARCHAR(256), owner VARCHAR(256), species VARCHAR(256), sex CHAR(1), birth DATE, death DATE);
load data local
infile '/tmp/log' into table test.pet8
fields terminated by '\t' optionally enclosed by '\"'
lines terminated by '\n'
ignore 1 lines;
select * from test.pet8
";
</pre>






== 20140311_220313 ==

=== Profiling of SQL activity in MySQL ===

* [http://www.drdobbs.com/database/detailed-profiling-of-sql-activity-in-my/240154959 Detailed profiling of SQL activity in MySQL 5.6 // Mark Leith, June 03, 2013 // ((B.GOOD))]

* To enable all instruments dynamically
 <pre>
UPDATE performance_schema.setup_instruments
SET enabled = 'YES', timed = 'YES';
</pre>

* To disable all mutex instruments after enabling all (the above)
 <pre>
UPDATE performance_schema.setup_instruments
SET enabled = 'NO', timed = 'NO'
WHERE name LIKE 'wait/synch/mutex/%';
</pre>

* To see the list of instruments in performance_schema
 <pre>
SELECT * FROM performance_schema.setup_instruments;
</pre>



== 20140227_215526 ==

=== create some user / set grant privileges / show grants ===

 <pre>
mysql> create user 'brian'@'%' identified by 'kkk';
Query OK, 0 rows affected (0.01 sec)

mysql> select User,Host from mysql.user;
+-----------+--------------+
| User      | Host         |
+-----------+--------------+
| brian     | %            |
| repl      | %            |
| root      | %            |
| tpcc_user | %            |
| root      | 127.0.0.1    |
| root      | ::1          |
| root      | b02          |
|           | jimi-hendrix |
| root      | jimi-hendrix |
|           | localhost    |
| root      | localhost    |
| tpcc_user | localhost    |
+-----------+--------------+
12 rows in set (0.00 sec)

mysql> create user 'brian'@'localhost' identified by 'kkk';
Query OK, 0 rows affected (0.00 sec)

mysql> select User,Host from mysql.user;
+-----------+--------------+
| User      | Host         |
+-----------+--------------+
| brian     | %            |
| repl      | %            |
| root      | %            |
| tpcc_user | %            |
| root      | 127.0.0.1    |
| root      | ::1          |
| root      | b02          |
|           | jimi-hendrix |
| root      | jimi-hendrix |
|           | localhost    |
| brian     | localhost    |
| root      | localhost    |
| tpcc_user | localhost    |
+-----------+--------------+
13 rows in set (0.00 sec)

mysql> show grants;
+----------------------------------------------------------------------------------------------------------------------------------------+
| Grants for root@localhost                                                                                                              |
+----------------------------------------------------------------------------------------------------------------------------------------+
| GRANT ALL PRIVILEGES ON *.* TO 'root'@'localhost' IDENTIFIED BY PASSWORD '*5F6E71BF7C725D6604BC75AA0260D2D8E43F40EE' WITH GRANT OPTION |
| GRANT PROXY ON ''@'' TO 'root'@'localhost' WITH GRANT OPTION                                                                           |
+----------------------------------------------------------------------------------------------------------------------------------------+
2 rows in set (0.00 sec)

mysql> show grants for 'brian'@'%';
+------------------------------------------------------------------------------------------------------+
| Grants for brian@%                                                                                   |
+------------------------------------------------------------------------------------------------------+
| GRANT USAGE ON *.* TO 'brian'@'%' IDENTIFIED BY PASSWORD '*5F6E71BF7C725D6604BC75AA0260D2D8E43F40EE' |
+------------------------------------------------------------------------------------------------------+
1 row in set (0.00 sec)

mysql> show grants for 'brian'@'localhost';
+--------------------------------------------------------------------------------------------------------------+
| Grants for brian@localhost                                                                                   |
+--------------------------------------------------------------------------------------------------------------+
| GRANT USAGE ON *.* TO 'brian'@'localhost' IDENTIFIED BY PASSWORD '*5F6E71BF7C725D6604BC75AA0260D2D8E43F40EE' |
+--------------------------------------------------------------------------------------------------------------+
1 row in set (0.00 sec)

mysql> show grants for 'brian';
+------------------------------------------------------------------------------------------------------+
| Grants for brian@%                                                                                   |
+------------------------------------------------------------------------------------------------------+
| GRANT USAGE ON *.* TO 'brian'@'%' IDENTIFIED BY PASSWORD '*5F6E71BF7C725D6604BC75AA0260D2D8E43F40EE' |
+------------------------------------------------------------------------------------------------------+
1 row in set (0.00 sec)

mysql> grant all privileges on *.* to 'brian'@'localhost' identified by 'kkk' with grant option;
Query OK, 0 rows affected (0.00 sec)

mysql> grant all privileges on *.* to 'brian'@'%' identified by 'kkk' with grant option;
Query OK, 0 rows affected (0.00 sec)

mysql> show grants;
+----------------------------------------------------------------------------------------------------------------------------------------+
| Grants for root@localhost                                                                                                              |
+----------------------------------------------------------------------------------------------------------------------------------------+
| GRANT ALL PRIVILEGES ON *.* TO 'root'@'localhost' IDENTIFIED BY PASSWORD '*5F6E71BF7C725D6604BC75AA0260D2D8E43F40EE' WITH GRANT OPTION |
| GRANT PROXY ON ''@'' TO 'root'@'localhost' WITH GRANT OPTION                                                                           |
+----------------------------------------------------------------------------------------------------------------------------------------+
2 rows in set (0.00 sec)

mysql> show grants for brian;
+---------------------------------------------------------------------------------------------------------------------------------+
| Grants for brian@%                                                                                                              |
+---------------------------------------------------------------------------------------------------------------------------------+
| GRANT ALL PRIVILEGES ON *.* TO 'brian'@'%' IDENTIFIED BY PASSWORD '*5F6E71BF7C725D6604BC75AA0260D2D8E43F40EE' WITH GRANT OPTION |
+---------------------------------------------------------------------------------------------------------------------------------+
1 row in set (0.00 sec)

mysql> show grants for brian@%;
ERROR 1064 (42000): You have an error in your SQL syntax; check the manual that corresponds to your MySQL server version for the right syntax to use near '%' at line 1

mysql> show grants for 'brian'@'%';
+---------------------------------------------------------------------------------------------------------------------------------+
| Grants for brian@%                                                                                                              |
+---------------------------------------------------------------------------------------------------------------------------------+
| GRANT ALL PRIVILEGES ON *.* TO 'brian'@'%' IDENTIFIED BY PASSWORD '*5F6E71BF7C725D6604BC75AA0260D2D8E43F40EE' WITH GRANT OPTION |
+---------------------------------------------------------------------------------------------------------------------------------+
1 row in set (0.00 sec)

mysql> show grants for 'brian'@'localhost';
+-----------------------------------------------------------------------------------------------------------------------------------------+
| Grants for brian@localhost                                                                                                              |
+-----------------------------------------------------------------------------------------------------------------------------------------+
| GRANT ALL PRIVILEGES ON *.* TO 'brian'@'localhost' IDENTIFIED BY PASSWORD '*5F6E71BF7C725D6604BC75AA0260D2D8E43F40EE' WITH GRANT OPTION |
+-----------------------------------------------------------------------------------------------------------------------------------------+
1 row in set (0.00 sec)

mysql> 

</pre>




== 20140218_000051 ==

=== mysql-5.7.3-m13 build and install ===

$ cmake .

$ make; sudo make install;

$ cd /usr/local/x/mysql

$ chown -R mysql:mysql .

$ (cd /etc; mv mysql mysql-5.5.31; mkdir mysql-5.7.3; ln -s mysql-5.7.3 mysql;)

$ scripts/mysql_install_db --no-defaults --basedir=/usr/local/x/mysql --datadir=/usr/local/x/mysql/data --port=3306 --user=mysql --bind-address=0.0.0.0 --log-error=/usr/local/x/mysql/log/error.log --innodb-buffer-pool-size=256M --socket=/var/run/mysqld/mysqld.sock


$ cat > /etc/mysql/my.cnf << EOF
# For advice on how to change settings please see
# http://dev.mysql.com/doc/refman/5.7/en/server-configuration-defaults.html

[mysqld]

# Remove leading # and set to the amount of RAM for the most important data
# cache in MySQL. Start at 70% of total RAM for dedicated server, else 10%.
# innodb_buffer_pool_size = 128M

# Remove leading # to turn on a very important data integrity option: logging
# changes to the binary log between backups.
# log_bin

# These are commonly set, remove the # and set as required.
# basedir = .....
# datadir = .....
# port = .....
# server_id = .....
# socket = .....

# Remove leading # to set options mainly useful for reporting servers.
# The server defaults are faster for transactions and fast SELECTs.
# Adjust sizes as needed, experiment to find the optimal values.
# join_buffer_size = 128M
# sort_buffer_size = 2M
# read_rnd_buffer_size = 2M 

# sql_mode=NO_ENGINE_SUBSTITUTION,STRICT_TRANS_TABLES 
#

user = mysql
basedir = /usr/local/x/mysql
datadir = /usr/local/x/mysql/data
log_error = /usr/local/x/mysql/log/error.log
socket = /var/run/mysqld/mysqld.sock # very important
port = 3306
bind_address = 0.0.0.0
innodb_buffer_pool_size = 256M


[client]

socket = /var/run/mysqld/mysqld.sock # very important


[mysqld_safe]

socket = /var/run/mysqld/mysqld.sock # very important


EOF




$ bin/mysqld --defaults-file=/etc/mysql-5.7.3/my.cnf &




:* error case which generates a error message
 <pre>

root@ROSES:mysql-5.7.3-m13 %1# ./scripts/mysql_install_db --user=mysql
Installing MySQL system tables...2014-02-17T14:43:19.855325Z 0 [ERROR] Can't read from messagefile '/usr/share/mysql/english/errmsg.sys'
</pre>

:* good case which does not generate a error message <ref>[http://bugs.mysql.com/bug.php?id=69677 Can't read from messagefile '/usr/share/mysql/english/errmsg.sys' // Very Good Explanation]</ref>
: the answer is to append '--no-defaults' option
 <pre>
root@ROSES:mysql-5.7.3-m13 %1# ./scripts/mysql_install_db --user=mysql --no-defaults
Installing MySQL system tables...OK

Filling help tables...OK

To start mysqld at boot time you have to copy
support-files/mysql.server to the right place for your system




update-rc.d how-to: Put it in /etc/init.d/your-script (or link to it). Make executable, and add to init services:

$ sudo chmod +x /etc/init.d/your-script
$ sudo update-rc.d your-script defaults
Now you can start and stop your service:

$ sudo your-script start
$ sudo your-script stop




PLEASE REMEMBER TO SET A PASSWORD FOR THE MySQL root USER !
To do so, start the server, then issue the following commands:

  ./bin/mysqladmin -u root password 'new-password'
  ./bin/mysqladmin -u root -h ROSES password 'new-password'

Alternatively you can run:

  ./bin/mysql_secure_installation

which will also give you the option of removing the test
databases and anonymous user created by default.  This is
strongly recommended for production servers.

See the manual for more instructions.

You can start the MySQL daemon with:

  cd . ; ./bin/mysqld_safe &

You can test the MySQL daemon with mysql-test-run.pl

  cd mysql-test ; perl mysql-test-run.pl

Please report any problems with the ./bin/mysqlbug script!

The latest information about MySQL is available on the web at

  http://www.mysql.com

Support MySQL by buying support/licenses at http://shop.mysql.com

WARNING: Found existing config file ./my.cnf on the system.
Because this file might be in use, it was not replaced,
but was used in bootstrap (unless you used --defaults-file)
and when you later start the server.
The new default config file was created as ./my-new.cnf,
please compare it with your file and take the changes you need.

WARNING: Default config file /etc/mysql/my.cnf exists on the system
This file will be read by default by the MySQL server
If you do not want to use this, either remove it, or use the
--defaults-file argument to mysqld_safe when starting the server
</pre>


:* related article
 <pre>
[5 Jul 2013 11:07] Arnaud Adant
Description:
On Ubuntu 12.04 with LAMP modules installed, the standard command for installing a database, mysql_install_db fails with this message :

./scripts/mysql_install_db --basedir=/home/aadant/mysql-5.6.10-linux-x86_65 --datadir=/home/aadant/data

Installing MySQL system tables...2013-06-20 11:39:41 0 [Warning] TIMESTAMP with implicit DEFAULT value is deprecated. Please use --explicit_defaults_for_timestamp server option (see documentation for more details).
2013-07-05 11:39:41 22620 [ERROR] Can't read from messagefile '/usr/share/mysql/english/errmsg.sys'

How to repeat:
1. install Ubuntu 12.04 with the LAMP option

2. run mysql_install_db according to the manual with basedir and datadir options.

Suggested fix:
This is not a bug, most likely a documentation feature request.

The problem comes from the fact that the LAMP option installs mysql 5.5.29 with
a configuration file in /etc/mysql/my.cnf

This configuration file contains this line :

lc-messages-dir = /usr/share/mysql

So mysqld reads this standard configuration file and can not read the 5.5 message file in 5.6, leading to this error.

Solutions :

1. pass your configuration file to mysql_install_db

./scripts/mysql_install_db --defaults-file=my.cnf

2. use --no-defaults, not to read other configuration files

./scripts/mysql_install_db --no-defaults --basedir=/home/aadant/mysql-5.6.10-linux-x86_65 --datadir=/home/aadant/data

The manual could document those options.
</pre>




== 20130418_015723 ==

=== create database and table, insert data, select records ranging from a to b ===

* create database and table
 <pre>
$ mysql -p -u root

mysql>
mysql> CREATE DATABASE books;
mysql> USE books;
mysql> CREATE TABLE authors (id INT, name VARCHAR(30), email VARCHAR(50));
mysql> SHOW TABLES;
mysql>
</pre>

* insert data
 <pre>
$ mysql -p -u root

mysql>
mysql> USE books;
mysql> INSERT INTO authors (id, name, email) VALUES(1, "apple", "bvidz.apple@gmail.com");
mysql> INSERT INTO authors (id, name, email) VALUES(2, "banana", "bvidz.banana@gmail.com");
mysql> INSERT INTO authors (id, name, email) VALUES(3, "cherry", "bvidz.cherry@gmail.com");
mysql> INSERT INTO authors (id, name, email) VALUES(4, "durian", "bvidz.durian@gmail.com");
mysql> INSERT INTO authors (id, name, email) VALUES(5, "elderberry", "bvidz.elderberry@gmail.com");
mysql> SELECT * FROM authors;
mysql>
</pre>

* select records ranging from a to b
 <pre>
$ mysql -p -u root
mysql>
mysql> USE books;
mysql> SELECT name FROM authors WHERE id BETWEEN 2 AND 3;
mysql>

$ mysql -p -u root --batch --silent -e 'use books; select name from authors where id between 2 and 3;' 
</pre>




== 20130407_224536 ==

=== extract information using SELECT ===

* extract user_name (column) from mw_user (table) of wikidb (database)
 <pre>
mysql> select user_name from wikidb.mw_user;
+-----------+
| user_name |
+-----------+
| Admin     |
| Blusjune  |
+-----------+
2 rows in set (0.00 sec)

</pre>




== 20130402_014346 ==

=== export and import database using mysqldump ===

* Reference
:- [http://www.cyberciti.biz/faq/import-mysql-dumpfile-sql-datafile-into-my-database/ Import MySQL Dumpfile, SQL Datafile Into My Database]
:- [http://stackoverflow.com/questions/105776/how-do-i-restore-a-mysql-dump-file How do I restore a MySQL .dump file?]
:- [http://stackoverflow.com/questions/859313/import-sql-dump-into-mysql Import SQL dump into MySQL]

 <pre>
$ mysqldump -p -u root wikidb > wikidb.sql
$ mysql -p -u root;
mysql> create database wikini;
$ mysql -p -u root wikini < wikidb.sql
</pre>




== 20130108_133330 ==
=== migration mysql db from this to another machine ===

* reference
: [http://stackoverflow.com/questions/328922/transfer-mysql-database-to-another-computer transfer mysql databse to another computer // stackoverflow]

 <pre>
$ mysqldump -u username -p wikidb > wikidb.sql;
	# basic essential minimal command.
	# 'wikiuser' was the name for 'wikidb', but
	# you may have to use 'root' username.
$ mysqldump -u username --opt --compress --all-databases > alldb.sql;
	# benefit of this way is: you will not lose user privilege settings.
</pre>




== 20121212_225118 ==

=== BMF (Benchmark Factory) Trouble-shooting ===
* when you get the following error message at BMF (benchmark factory) mysql connection test
 [MySQL][ODBC 3.51 driver] Can't Connect to mysql server on 'b07' (10061)

: 1. please make sure that the mysql bind address is set to '0.0.0.0' not '127.0.0.1'
 <pre>
	foo@bar$ vi /etc/mysql/my.cnf
		bind-address	= 0.0.0.0
	foo@bar$ /etc/init.d/mysql restart
</pre>
: 2. and then reconnect to the mysql db server from the BMF (benchmark factory)
: 3. you may want to control the size of memory buffer pool of mysql db server




== 20121107_013343 ==

=== 'some_db_user'@'%' Vs. 'some_db_user'@'localhost' ===

* It is very important to add both of 'tpcc_user'@'%' and 'tpcc_user'@'localhost' as the following
:- 'tpcc_user'@'%' to allow remote access to this host's mysql
:- 'tpcc_user'@'localhost' to allow local login into this host's mysql

* It also seems important to include 'WITH GRANT OPTION' statement while 'GRANT' command processing

 <pre>
mysql> CREATE USER 'tpcc_user'@'localhost' IDENTIFIED BY 'some_pass';
mysql> GRANT ALL PRIVILEGES ON *.* TO 'tpcc_user'@'localhost'
    ->     WITH GRANT OPTION;
mysql> CREATE USER 'tpcc_user'@'%' IDENTIFIED BY 'some_pass';
mysql> GRANT ALL PRIVILEGES ON *.* TO 'tpcc_user'@'%'
    ->     WITH GRANT OPTION;
</pre>




== 20121212_225051 ==

=== Create mysql user and configure the privilege ===

 <pre>
$ mysql -u root -p;

mysql> select * from mysql.user;
mysql> create user badboy identified by 'not_correct_pswd';
mysql> drop user badboy;
mysql> create user goodgirl identified by 'mypswd';
mysql> show grants for goodgirl;
mysql> grant all on *.* to goodgirl;
mysql> grant all privileges on *.* to goodgirl;
mysql> show grants for goodgirl;
mysql> grant reload, process on *.* to goodgirl;
</pre>

* Reference
: [http://dev.mysql.com/doc/refman/5.5/en//adding-users.html MySQL Adding Users]

 <pre>
mysql> CREATE USER 'monty'@'localhost' IDENTIFIED BY 'some_pass';
mysql> GRANT ALL PRIVILEGES ON *.* TO 'monty'@'localhost'
    ->     WITH GRANT OPTION;
mysql> CREATE USER 'monty'@'%' IDENTIFIED BY 'some_pass';
mysql> GRANT ALL PRIVILEGES ON *.* TO 'monty'@'%'
    ->     WITH GRANT OPTION;
mysql> CREATE USER 'admin'@'localhost';
mysql> GRANT RELOAD,PROCESS ON *.* TO 'admin'@'localhost';
mysql> CREATE USER 'dummy'@'localhost';

mysql> SHOW GRANTS FOR 'admin'@'localhost';
+-----------------------------------------------------+
| Grants for admin@localhost                          |
+-----------------------------------------------------+
| GRANT RELOAD, PROCESS ON *.* TO 'admin'@'localhost' |
+-----------------------------------------------------+

shell> mysql --user=root mysql
mysql> INSERT INTO user
    ->     VALUES('localhost','monty',PASSWORD('some_pass'),
    ->     'Y','Y','Y','Y','Y','Y','Y','Y','Y','Y','Y','Y','Y','Y');
mysql> INSERT INTO user
    ->     VALUES('%','monty',PASSWORD('some_pass'),
    ->     'Y','Y','Y','Y','Y','Y','Y','Y','Y','Y','Y','Y','Y','Y',
    ->     'Y','Y','Y','Y','Y','Y','Y','Y','Y','Y','Y','Y','Y','Y',
    ->     '','','','',0,0,0,0);
mysql> INSERT INTO user SET Host='localhost',User='admin',
    ->     Reload_priv='Y', Process_priv='Y';
mysql> INSERT INTO user (Host,User,Password)
    ->     VALUES('localhost','dummy','');
mysql> FLUSH PRIVILEGES;
</pre>




